{
  "id": "lab-002",
  "description": "Happy path: Normal lab result (TSH 2.1 mIU/L) with LOINC code",
  "dataType": "LabResult",
  "vocabulary": "health",
  "input": {
    "id": "urn:uuid:1ab0-0010-aaaa-bbbb-ccccddddeeee",
    "type": "LabResultRecord",
    "testName": "Thyroid Stimulating Hormone",
    "resultValue": "2.1",
    "interpretation": "normal",
    "performedDate": "2026-01-15T08:30:00Z",
    "dataProvenance": "ClinicalGenerated",
    "schemaVersion": "1.3",
    "testCode": "http://loinc.org/rdf#3016-3",
    "labCategory": "Chemistry",
    "resultUnit": "mIU/L",
    "referenceRange": "0.4 - 4.0",
    "specimenType": "Serum",
    "reportedDate": "2026-01-15T14:00:00Z",
    "orderingProvider": "Dr. Sarah Chen",
    "performingLab": "Cascade Regional Medical Lab",
    "notes": "Normal thyroid function.",
    "sourceRecordId": "ehr-lab-2026-0115-010"
  },
  "expectedOutput": {
    "turtle": "@prefix cascade: <https://ns.cascadeprotocol.org/core/v1#> .\n@prefix health: <https://ns.cascadeprotocol.org/health/v1#> .\n@prefix loinc: <http://loinc.org/rdf#> .\n@prefix xsd: <http://www.w3.org/2001/XMLSchema#> .\n\n<urn:uuid:1ab0-0010-aaaa-bbbb-ccccddddeeee> a health:LabResultRecord ;\n    health:testName \"Thyroid Stimulating Hormone\" ;\n    health:resultValue \"2.1\" ;\n    health:interpretation \"normal\" ;\n    health:performedDate \"2026-01-15T08:30:00Z\"^^xsd:dateTime ;\n    cascade:dataProvenance cascade:ClinicalGenerated ;\n    cascade:schemaVersion \"1.3\" ;\n    health:testCode <http://loinc.org/rdf#3016-3> ;\n    health:labCategory \"Chemistry\" ;\n    health:resultUnit \"mIU/L\" ;\n    health:referenceRange \"0.4 - 4.0\" ;\n    health:specimenType \"Serum\" ;\n    health:reportedDate \"2026-01-15T14:00:00Z\"^^xsd:dateTime ;\n    health:orderingProvider \"Dr. Sarah Chen\" ;\n    health:performingLab \"Cascade Regional Medical Lab\" ;\n    health:notes \"Normal thyroid function.\" ;\n    health:sourceRecordId \"ehr-lab-2026-0115-010\" .\n",
    "validationMode": "shacl-valid"
  },
  "shouldAccept": true,
  "tags": ["happy-path", "clinical", "ehr-import"],
  "notes": "Based on Lab 10 (TSH) from the Reference Patient Pod. Tests normal lab result interpretation."
}
