{
  "id": "lab-004",
  "description": "Multi-code: Lab result (LDL Cholesterol) with LOINC code and alternative hematology category",
  "dataType": "LabResult",
  "vocabulary": "health",
  "input": {
    "id": "urn:uuid:1ab0-0004-aaaa-bbbb-ccccddddeeee",
    "type": "LabResultRecord",
    "testName": "LDL Cholesterol",
    "resultValue": "112",
    "interpretation": "abnormal",
    "performedDate": "2026-01-15T08:30:00Z",
    "dataProvenance": "ClinicalGenerated",
    "schemaVersion": "1.3",
    "testCode": "http://loinc.org/rdf#2089-1",
    "labCategory": "Chemistry",
    "resultUnit": "mg/dL",
    "referenceRange": "< 100",
    "specimenType": "Serum",
    "reportedDate": "2026-01-15T14:00:00Z",
    "orderingProvider": "Dr. Sarah Chen",
    "performingLab": "Cascade Regional Medical Lab",
    "notes": "Above target of <100 mg/dL for patient with diabetes. Consider statin dose adjustment.",
    "sourceRecordId": "ehr-lab-2026-0115-004"
  },
  "expectedOutput": {
    "turtle": "@prefix cascade: <https://ns.cascadeprotocol.org/core/v1#> .\n@prefix health: <https://ns.cascadeprotocol.org/health/v1#> .\n@prefix loinc: <http://loinc.org/rdf#> .\n@prefix xsd: <http://www.w3.org/2001/XMLSchema#> .\n\n<urn:uuid:1ab0-0004-aaaa-bbbb-ccccddddeeee> a health:LabResultRecord ;\n    health:testName \"LDL Cholesterol\" ;\n    health:resultValue \"112\" ;\n    health:interpretation \"abnormal\" ;\n    health:performedDate \"2026-01-15T08:30:00Z\"^^xsd:dateTime ;\n    cascade:dataProvenance cascade:ClinicalGenerated ;\n    cascade:schemaVersion \"1.3\" ;\n    health:testCode <http://loinc.org/rdf#2089-1> ;\n    health:labCategory \"Chemistry\" ;\n    health:resultUnit \"mg/dL\" ;\n    health:referenceRange \"< 100\" ;\n    health:specimenType \"Serum\" ;\n    health:reportedDate \"2026-01-15T14:00:00Z\"^^xsd:dateTime ;\n    health:orderingProvider \"Dr. Sarah Chen\" ;\n    health:performingLab \"Cascade Regional Medical Lab\" ;\n    health:notes \"Above target of <100 mg/dL for patient with diabetes. Consider statin dose adjustment.\" ;\n    health:sourceRecordId \"ehr-lab-2026-0115-004\" .\n",
    "validationMode": "shacl-valid"
  },
  "shouldAccept": true,
  "tags": ["multi-code", "clinical", "ehr-import"],
  "notes": "Based on Lab 4 (LDL Cholesterol) from the Reference Patient Pod. Tests LOINC code 2089-1 and abnormal interpretation for lipid panel."
}
