{
  "id": "cond-005",
  "description": "Provenance: Condition with EHRVerified provenance for seasonal allergic rhinitis",
  "dataType": "Condition",
  "vocabulary": "health",
  "input": {
    "id": "urn:uuid:c0nd-0005-aaaa-bbbb-ccccddddeeee",
    "type": "ConditionRecord",
    "conditionName": "Seasonal Allergic Rhinitis",
    "status": "active",
    "dataProvenance": "ClinicalGenerated",
    "schemaVersion": "1.3",
    "onsetDate": "2010-04-15T00:00:00Z",
    "icd10Code": "http://hl7.org/fhir/sid/icd-10-cm/J30.2",
    "snomedCode": "http://snomed.info/sct/367498001",
    "notes": "Seasonal symptoms managed with OTC cetirizine. Worst in spring.",
    "sourceRecordId": "ehr-cond-2010-0415-001"
  },
  "expectedOutput": {
    "turtle": "@prefix cascade: <https://ns.cascadeprotocol.org/core/v1#> .\n@prefix health: <https://ns.cascadeprotocol.org/health/v1#> .\n@prefix sct: <http://snomed.info/sct/> .\n@prefix icd10: <http://hl7.org/fhir/sid/icd-10-cm/> .\n@prefix xsd: <http://www.w3.org/2001/XMLSchema#> .\n\n<urn:uuid:c0nd-0005-aaaa-bbbb-ccccddddeeee> a health:ConditionRecord ;\n    health:conditionName \"Seasonal Allergic Rhinitis\" ;\n    health:status \"active\" ;\n    cascade:dataProvenance cascade:ClinicalGenerated ;\n    cascade:schemaVersion \"1.3\" ;\n    health:onsetDate \"2010-04-15T00:00:00Z\"^^xsd:dateTime ;\n    health:icd10Code <http://hl7.org/fhir/sid/icd-10-cm/J30.2> ;\n    health:snomedCode <http://snomed.info/sct/367498001> ;\n    health:notes \"Seasonal symptoms managed with OTC cetirizine. Worst in spring.\" ;\n    health:sourceRecordId \"ehr-cond-2010-0415-001\" .\n",
    "validationMode": "shacl-valid"
  },
  "shouldAccept": true,
  "tags": ["provenance", "clinical", "ehr-import"],
  "notes": "Based on Condition 5 (Seasonal Allergic Rhinitis) from the Reference Patient Pod. Tests minimal condition without conditionClass or monitoredVitalSigns."
}
