{
  "id": "encounter-001",
  "description": "Happy path: Ambulatory endocrinology office visit from EHR import",
  "dataType": "Encounter",
  "vocabulary": "clinical",
  "input": {
    "id": "urn:uuid:enc0-0001-aaaa-bbbb-ccccddddeeee",
    "type": "Encounter",
    "encounterType": "Endocrinology office visit",
    "encounterClass": "AMB",
    "encounterStatus": "finished",
    "encounterStart": "2026-01-15T09:00:00Z",
    "encounterEnd": "2026-01-15T09:45:00Z",
    "providerName": "Dr. Sarah Chen, MD - Endocrinology",
    "dataProvenance": "ClinicalGenerated",
    "schemaVersion": "1.3",
    "sourceRecordId": "ehr-enc-2026-0115-001"
  },
  "expectedOutput": {
    "turtle": "@prefix cascade: <https://ns.cascadeprotocol.org/core/v1#> .\n@prefix health: <https://ns.cascadeprotocol.org/health/v1#> .\n@prefix clinical: <https://ns.cascadeprotocol.org/clinical/v1#> .\n@prefix xsd: <http://www.w3.org/2001/XMLSchema#> .\n\n<urn:uuid:enc0-0001-aaaa-bbbb-ccccddddeeee> a clinical:Encounter ;\n    clinical:encounterType \"Endocrinology office visit\" ;\n    clinical:encounterClass \"AMB\" ;\n    clinical:encounterStatus \"finished\" ;\n    clinical:encounterStart \"2026-01-15T09:00:00Z\"^^xsd:dateTime ;\n    clinical:encounterEnd \"2026-01-15T09:45:00Z\"^^xsd:dateTime ;\n    clinical:providerName \"Dr. Sarah Chen, MD - Endocrinology\" ;\n    cascade:dataProvenance cascade:ClinicalGenerated ;\n    cascade:schemaVersion \"1.3\" ;\n    health:sourceRecordId \"ehr-enc-2026-0115-001\" .\n",
    "validationMode": "shacl-valid"
  },
  "shouldAccept": true,
  "tags": ["happy-path", "clinical", "ehr-import"],
  "notes": "Tests core Encounter serialization for an ambulatory endocrinology visit with start/end times."
}
