{
  "id": "encounter-002",
  "description": "Emergency department encounter with date-precision period and a SNOMED CT type code, exercising the clinical:EncounterShape added in clinical v1.14",
  "dataType": "Encounter",
  "vocabulary": "clinical",
  "input": {
    "id": "urn:uuid:enc0-0002-aaaa-bbbb-ccccddddeeee",
    "type": "Encounter",
    "encounterType": "Emergency department visit",
    "encounterClass": "EMER",
    "encounterStatus": "finished",
    "encounterStart": "2031-06-04",
    "encounterEnd": "2031-06-04",
    "snomedCode": "http://snomed.info/sct/50849002",
    "providerName": "Dr Wrenfield Ashcombe",
    "facilityName": "Northbrook Synthetic Regional Hospital",
    "dataProvenance": "ClinicalGenerated",
    "schemaVersion": "1.3",
    "sourceRecordId": "synthetic-enc-2031-0604-002"
  },
  "expectedOutput": {
    "turtle": "@prefix cascade: <https://ns.cascadeprotocol.org/core/v1#> .\n@prefix clinical: <https://ns.cascadeprotocol.org/clinical/v1#> .\n@prefix xsd: <http://www.w3.org/2001/XMLSchema#> .\n\n<urn:uuid:enc0-0002-aaaa-bbbb-ccccddddeeee> a clinical:Encounter ;\n    clinical:encounterType \"Emergency department visit\" ;\n    clinical:encounterClass \"EMER\" ;\n    clinical:encounterStatus \"finished\" ;\n    clinical:encounterStart \"2031-06-04\"^^xsd:date ;\n    clinical:encounterEnd \"2031-06-04\"^^xsd:date ;\n    clinical:snomedCode <http://snomed.info/sct/50849002> ;\n    clinical:providerName \"Dr Wrenfield Ashcombe\" ;\n    clinical:facilityName \"Northbrook Synthetic Regional Hospital\" ;\n    cascade:dataProvenance cascade:ClinicalGenerated ;\n    cascade:schemaVersion \"1.3\" ;\n    clinical:sourceRecordId \"synthetic-enc-2031-0604-002\" .\n",
    "validationMode": "shacl-valid"
  },
  "shouldAccept": true,
  "tags": [
    "happy-path",
    "clinical",
    "ehr-import"
  ],
  "notes": "Fully synthetic. clinical:Encounter was defined in clinical v1.7 and targeted by no shape until v1.14, so encounter-001 sat in KNOWN_FAILURES as UNSHAPED: it reported conforming while evaluating zero constraints. encounterClass 'EMER' is deliberately a v3-ActCode abbreviation rather than a display word, because the shape imposes no enum there (FHIR binds Encounter.class extensibly)."
}
