{
  "id": "fam-001",
  "description": "Happy path: Mother with Type 2 Diabetes diagnosed at age 48",
  "dataType": "FamilyHistory",
  "vocabulary": "health",
  "input": {
    "id": "urn:uuid:fhx0-0001-aaaa-bbbb-ccccddddeeee",
    "type": "FamilyHistoryRecord",
    "relationship": "mother",
    "conditionName": "Type 2 Diabetes Mellitus",
    "onsetAge": 48,
    "dataProvenance": "SelfReported",
    "schemaVersion": "1.3",
    "notes": "Mother manages diabetes with metformin and dietary modifications.",
    "sourceRecordId": "patient-fhx-mother-diabetes"
  },
  "expectedOutput": {
    "turtle": "@prefix cascade: <https://ns.cascadeprotocol.org/core/v1#> .\n@prefix health: <https://ns.cascadeprotocol.org/health/v1#> .\n@prefix clinical: <https://ns.cascadeprotocol.org/clinical/v1#> .\n@prefix xsd: <http://www.w3.org/2001/XMLSchema#> .\n\n<urn:uuid:fhx0-0001-aaaa-bbbb-ccccddddeeee> a health:FamilyHistoryRecord ;\n    clinical:relationship \"mother\" ;\n    health:conditionName \"Type 2 Diabetes Mellitus\" ;\n    health:onsetAge 48 ;\n    cascade:dataProvenance cascade:SelfReported ;\n    cascade:schemaVersion \"1.3\" ;\n    health:notes \"Mother manages diabetes with metformin and dietary modifications.\" ;\n    health:sourceRecordId \"patient-fhx-mother-diabetes\" .\n",
    "validationMode": "shacl-valid"
  },
  "shouldAccept": true,
  "tags": ["happy-path", "self-reported"],
  "notes": "Tests family history serialization with self-reported provenance. Uses clinical:relationship predicate (shared with Coverage)."
}
