{
  "id": "coverage-001",
  "description": "Happy path: Primary insurance coverage (Blue Cross Blue Shield PPO) from EHR",
  "dataType": "Coverage",
  "vocabulary": "clinical",
  "input": {
    "id": "urn:uuid:c0vr-0001-aaaa-bbbb-ccccddddeeee",
    "type": "CoverageRecord",
    "providerName": "Blue Cross Blue Shield",
    "memberId": "BCBS-AR-2020-78452",
    "dataProvenance": "ClinicalGenerated",
    "schemaVersion": "1.3",
    "groupNumber": "GRP-98765",
    "planName": "Blue PPO Select",
    "planType": "ppo",
    "coverageType": "primary",
    "relationship": "self",
    "effectivePeriodStart": "2020-01-01T00:00:00Z",
    "payorName": "Blue Cross Blue Shield of Oregon",
    "subscriberId": "BCBS-AR-2020-78452",
    "sourceRecordId": "ehr-coverage-2020-0101-001"
  },
  "expectedOutput": {
    "turtle": "@prefix cascade: <https://ns.cascadeprotocol.org/core/v1#> .\n@prefix health: <https://ns.cascadeprotocol.org/health/v1#> .\n@prefix clinical: <https://ns.cascadeprotocol.org/clinical/v1#> .\n@prefix xsd: <http://www.w3.org/2001/XMLSchema#> .\n\n<urn:uuid:c0vr-0001-aaaa-bbbb-ccccddddeeee> a clinical:CoverageRecord ;\n    clinical:providerName \"Blue Cross Blue Shield\" ;\n    clinical:memberId \"BCBS-AR-2020-78452\" ;\n    cascade:dataProvenance cascade:ClinicalGenerated ;\n    cascade:schemaVersion \"1.3\" ;\n    clinical:groupNumber \"GRP-98765\" ;\n    clinical:planName \"Blue PPO Select\" ;\n    clinical:planType \"ppo\" ;\n    clinical:coverageType \"primary\" ;\n    clinical:relationship \"self\" ;\n    clinical:effectivePeriodStart \"2020-01-01T00:00:00Z\"^^xsd:dateTime ;\n    clinical:payorName \"Blue Cross Blue Shield of Oregon\" ;\n    clinical:subscriberId \"BCBS-AR-2020-78452\" ;\n    health:sourceRecordId \"ehr-coverage-2020-0101-001\" .\n",
    "validationMode": "shacl-valid"
  },
  "shouldAccept": true,
  "tags": ["happy-path", "clinical", "ehr-import"],
  "notes": "Based on Coverage 1 (Blue Cross Blue Shield PPO) from the Reference Patient Pod insurance.ttl file."
}
